{
  "$schema": "https://json-schema.org/draft/2020-12/schema",
  "type": "object",
  "required": ["schemaVersion", "exportId", "run", "score", "issues"],
  "additionalProperties": false,
  "properties": {
    "schemaVersion": { "const": "scan-export-v1" },
    "exportId": { "type": "string" },
    "run": { "type": "object" },
    "score": { "type": "object" },
    "issues": { "type": "array" },
    "pages": { "type": "array", "items": { "type": "object" } }
  }
}
